{
  "schema_version": "1.0.0",
  "dataset": {
    "id": "clinical_correlations_logic_seed",
    "title": "Clinical Correlations Logic Seed",
    "description": "Topographic, neurovascular, lesion and surgical-danger correlations designed to sit on top of the Anatomy Structures v2 database.",
    "generated_at": "2026-08-11T19:24:03Z",
    "content_status": "educational_seed_requires_human_review",
    "correlation_count": 40,
    "category_counts": {
      "topographic_vessel_relation": 7,
      "clinical_vessel_relation": 3,
      "compression_relation": 1,
      "topographic_duct_relation": 1,
      "topographic_bundle_relation": 6,
      "topographic_nerve_relation": 1,
      "foramen_content_relation": 4,
      "space_content_relation": 1,
      "gland_content_relation": 1,
      "topographic_nerve_duct_relation": 1,
      "fracture_neurovascular_relation": 3,
      "surface_nerve_relation": 1,
      "canal_content_relation": 4,
      "fracture_vascular_relation": 1,
      "surgical_danger_relation": 1,
      "lesion_correlation": 4
    },
    "synonyms_added_at": "2026-08-11T19:32:46Z",
    "query_support_status": "synonymized_seed_requires_review",
    "search_algorithm": {
      "algorithm_id": "clinical_correlation_fuzzy_search_v1",
      "supports": [
        "synonym expansion",
        "abbreviation expansion",
        "latin/english variants",
        "common misspellings",
        "bounded Levenshtein",
        "token coverage",
        "negative trap detection",
        "left/right and cranial-nerve safety rules"
      ],
      "recommended_min_score": 55,
      "recommended_direct_answer_score": 75,
      "recommended_ambiguous_delta": 8
    }
  },
  "logic_model": {
    "purpose": "Allow the app to answer and quiz clinically relevant relation questions, not just list isolated anatomical structures.",
    "query_intents": [
      {
        "intent": "what_passes_through",
        "slots": [
          "container_structure",
          "content_type"
        ],
        "example": "What passes through foramen spinosum?"
      },
      {
        "intent": "what_runs_along",
        "slots": [
          "surface_or_border",
          "organ_or_region",
          "side"
        ],
        "example": "What artery runs along the greater curvature of the stomach?"
      },
      {
        "intent": "what_is_vulnerable_at",
        "slots": [
          "injury_site",
          "structure_type"
        ],
        "example": "Which nerve is injured at the neck of fibula?"
      },
      {
        "intent": "what_does_lesion_cause",
        "slots": [
          "nerve_or_pathway"
        ],
        "example": "What happens in CN VI palsy?"
      },
      {
        "intent": "which_structure_supplies",
        "slots": [
          "target_structure",
          "supply_type"
        ],
        "example": "Which artery supplies the gallbladder?"
      },
      {
        "intent": "ordered_contents",
        "slots": [
          "space_or_triangle",
          "orientation"
        ],
        "example": "What is the order in the femoral triangle?"
      },
      {
        "intent": "clinical_explain_why",
        "slots": [
          "clinical_condition",
          "anatomical_relation"
        ],
        "example": "Why can a posterior duodenal ulcer bleed badly?"
      }
    ],
    "answer_contract": {
      "short_answer": "One direct answer suitable for search preview or quiz answer.",
      "exam_answer": "Direct answer plus relation, course/origin, clinical relevance and trap.",
      "provenance": "Always expose review status and source_refs. If source_refs are empty, show seed/review warning."
    },
    "ranking_rules": [
      "Exact structure/container match beats broad text match.",
      "Relation type matching the query intent beats generic clinical note match.",
      "Course week context can boost relevant correlations during course study.",
      "If several vessels/structures are correct, return ordered or segmented answer rather than one arbitrary result."
    ],
    "ui_badges": [
      "Topographic relation",
      "Clinical danger",
      "Foramen content",
      "Lesion sign",
      "Surgical relation",
      "Seed review needed"
    ]
  },
  "correlations": [
    {
      "id": "cc_stomach_greater_curvature_gastro_omental",
      "category": "topographic_vessel_relation",
      "subject": {
        "id": "organ_stomach",
        "name": "stomach: greater curvature"
      },
      "relation_type": "artery_runs_along",
      "target": {
        "id": "artery_gastro_omental_right_left",
        "name": "right and left gastro-omental arteries"
      },
      "answer": "The greater curvature of the stomach is supplied by an arterial arcade formed mainly by the right gastro-omental artery and the left gastro-omental artery.",
      "details": {
        "arteries": [
          {
            "name": "right gastro-omental artery",
            "origin": "gastroduodenal artery",
            "course": "runs from right to left along the greater curvature between layers of the greater omentum"
          },
          {
            "name": "left gastro-omental artery",
            "origin": "splenic artery",
            "course": "runs from left to right along the greater curvature"
          }
        ],
        "nearby_ligament": "gastrocolic ligament / greater omentum",
        "contrast": "lesser curvature is supplied by right and left gastric arteries"
      },
      "clinical_relevance": [
        "Important during gastric surgery and control of bleeding along the greater curvature."
      ],
      "exam_traps": [
        "Do not answer right gastric or left gastric artery; those follow the lesser curvature.",
        "Short gastric arteries supply mainly the fundus near the superior part of the greater curvature, not the full inferior greater-curvature arcade."
      ],
      "question_templates": [
        "Which arteries run along the greater curvature of the stomach?",
        "Which artery passes along the inferior/great-curvature side of the stomach?",
        "Greater curvature bleeding: which vessels are nearby?"
      ],
      "tags": [
        "stomach",
        "greater curvature",
        "gastro-omental",
        "blood supply"
      ],
      "course_tags": [
        "anat1_week_12",
        "anat1_week_13",
        "anat2_week_02"
      ],
      "difficulty": "core",
      "evidence": {
        "status": "seed_needs_review",
        "source_refs": [],
        "note": "Educational anatomy seed correlation. Requires human/faculty review before being marked verified."
      },
      "query_support": {
        "canonical_terms": [
          "stomach: greater curvature",
          "right and left gastro-omental arteries",
          "artery runs along",
          "stomach",
          "greater curvature",
          "gastro-omental",
          "blood supply"
        ],
        "direct_synonyms": [
          "stomach",
          "gaster",
          "ventriculus",
          "gastric",
          "žalúdok",
          "magen",
          "greater curvature",
          "curvatura major",
          "great curvature",
          "inferior border of stomach",
          "inferior side of stomach",
          "big curvature",
          "outer curvature",
          "large curvature",
          "gastromental",
          "gastro omental",
          "gastroomental",
          "gastroepiploic",
          "gastro epiploic",
          "gastrepiploic",
          "gastroepiploick",
          "gastro-omental artery",
          "gastroepiploic artery",
          "gastro omental artery",
          "gastro-epiploic",
          "arteria gastroomentalis",
          "arteria gastroepiploica",
          "right gastro-omental artery",
          "right gastroepiploic artery",
          "right gastro omental artery",
          "arteria gastroomentalis dextra",
          "arteria gastroepiploica dextra",
          "left gastro-omental artery",
          "left gastroepiploic artery",
          "left gastro omental artery",
          "arteria gastroomentalis sinistra",
          "arteria gastroepiploica sinistra",
          "artery along",
          "artery passes along",
          "artery runs on",
          "blood supply of border",
          "vessel on curvature",
          "inferior side of stomach artery",
          "great curvature artery",
          "greater omentum artery",
          "which artery passes along stomach greater curvature",
          "gastrocolic ligament vessels",
          "right and left gastroepiploic"
        ],
        "common_misspellings": [
          "gastromental",
          "gastro omental",
          "gastroomental",
          "gastroepiploic",
          "gastro epiploic",
          "gastrepiploic",
          "gastroepiploick"
        ],
        "abbreviations": [],
        "relation_phrases": [
          "artery along",
          "artery passes along",
          "artery runs on",
          "blood supply of border",
          "vessel on curvature"
        ],
        "negative_traps": [
          "Do not answer right gastric or left gastric artery; those follow the lesser curvature.",
          "Short gastric arteries supply mainly the fundus near the superior part of the greater curvature, not the full inferior greater-curvature arcade."
        ],
        "search_boosts": {
          "subject": 90,
          "target": 85,
          "direct_synonym": 75,
          "relation_phrase": 65,
          "clinical_relevance": 45,
          "exam_trap": 35,
          "fuzzy_term": 30
        }
      }
    },
    {
      "id": "cc_stomach_lesser_curvature_gastric",
      "category": "topographic_vessel_relation",
      "subject": {
        "id": "organ_stomach",
        "name": "stomach: lesser curvature"
      },
      "relation_type": "artery_runs_along",
      "target": {
        "id": "artery_gastric_right_left",
        "name": "right and left gastric arteries"
      },